ID	NAME	DESCRIPTION	ORGANIZATIONID	ISDELETED	ISVISIBLETOTIMECOLLECTION	ISTIMEOFFWITHALLOTMENT	ACCRUALSCHEDULE	ACCRUALPOLICY	TOYEARTYPE	TOYEARDATE
-5001	System Defined	System Category for internal use - also serves as a catch-all	-3001	0	0	0	0	0	0	NULL
-5002	Assigned Work Activities	Assigned activities such as Phone or Research	-3002	0	1	0	0	0	0	NULL
-5003	Shift Events	Activities during a shift such as Lunch or Coffee Break	-3002	0	1	0	0	0	0	NULL
-5004	Planned Events	Planned activities such as Training or Staff Meeting	-3002	0	1	0	0	0	0	NULL
-5005	Absence Activities	Absent activities such as Vacation or Jury Duty	-3002	0	1	0	0	0	0	NULL
-5006	Learning Activities	Learning Activities	-3002	0	0	0	0	0	0	NULL
-5007	Desktop Monitoring	Desktop Monitoring	-3002	0	1	0	0	0	0	NULL
1	My Time General	Includes states like break & lunch that all my time agents would use	-3002	0	1	0	0	0	0	NULL
2	My Time AS	Activities for AS My Time Use	-3002	0	1	0	0	0	0	NULL